{
  "schema_version": "1.0.0",
  "candidate_id": "CAND-TEMPLATE-001",
  "artifact_status": "draft",
  "name": "Replace with system name",
  "version": "replace-version",
  "code_revision": "replace-revision",
  "environment": "production_candidate",
  "intended_uses": ["Replace with a bounded intended use"],
  "prohibited_uses": ["Replace with a prohibited use"],
  "jurisdictions": ["Replace jurisdiction"],
  "models": [{"purpose": "generation", "provider": "replace-provider", "model_id": "replace-model", "version": "replace-version", "version_pinned": false}],
  "prompt_bundle_path": "artifacts/prompt-bundle.txt",
  "prompt_bundle_sha256": "0000000000000000000000000000000000000000000000000000000000000000",
  "configuration_path": "artifacts/runtime-config.json",
  "configuration_sha256": "0000000000000000000000000000000000000000000000000000000000000000",
  "retrieval": {"enabled": false, "corpus_version": null, "index_version": null, "embedding_model": null},
  "tools": [],
  "data_classes": ["replace-data-class"],
  "risk_profile": {"impact": "low", "autonomy": "assistive", "data_sensitivity": "public", "exposure": "isolated"},
  "declared_tier": "tier_1",
  "applicability": {"uses_personal_data": false, "affects_rights_or_access": false, "uses_model_grader": false, "has_external_actions": false, "has_accessibility_impact": false, "regulated_use": false},
  "rollback_target": "replace-with-approved-baseline-or-disable-path"
}
